### ISSUE TITLE
Centos 6.6: no networking

### ISSUE THREAD

**Issue by Darren** [mist64/xhyve#28]
After booting No IP is assigned, So I use static IP address, and try ping from mac, No response
here's the tcpdump output:

tcpdump -i eth0 -n 
```bash
device eth0 entered promiscuous mode
tcpdump: verbose output suppressed, use -v or -vv for full protocol decode
listening on eth0, link-type EN10MB (Ethernet), capture size 65535 bytes
19:09:02.346079 ARP, Request who-has 192.168.64.3 tell 192.168.64.1, length 28
19:09:02.346098 ARP, Reply 192.168.64.3 is-at 06:9d:38:56:cf:32, length 28
19:09:03.346634 ARP, Request who-has 192.168.64.3 tell 192.168.64.1, length 28
19:09:03.346657 ARP, Reply 192.168.64.3 is-at 06:9d:38:56:cf:32, length 28
19:09:04.347690 ARP, Request who-has 192.168.64.3 tell 192.168.64.1, length 28
19:09:04.347707 ARP, Reply 192.168.64.3 is-at 06:9d:38:56:cf:32, length 28
19:09:05.348359 ARP, Request who-has 192.168.64.3 tell 192.168.64.1, length 28
19:09:05.348371 ARP, Reply 192.168.64.3 is-at 06:9d:38:56:cf:32, length 28
```
here's the startup script

```bash
#!/bin/sh

KERNEL="boot/vmlinuz-2.6.32-504.el6.x86_64"
INITRD="boot/initramfs-2.6.32-504.el6.x86_64.img"
CMDLINE="earlyprintk=serial console=ttyS0 acpi=off ro root=/dev/mapper/VolGroup-lv_root rd_NO_LUKS LANG=en_US.UTF-8 rd_NO_MD  KEYTABLE=us rd_LVM_LV=VolGroup/lv_swap console=ttyS0 acpi=off crashkernel=auto rd_LVM_LV=VolGroup/lv_root SYSFONT=latarcyrheb-sun16 rd_NO_DM"

MEM="-m 1G"
#SMP="-c 2"
NET="-s 2:0,virtio-net"
IMG_CD="-s 3,ahci-cd,centos6.6.iso"
IMG_HDD="-s 4,virtio-blk,hdd.img"
PCI_DEV="-s 0:0,hostbridge -s 31,lpc"
LPC_DEV="-l com1,stdio"
UUID="-U 8ecf0427-4692-467b-8478-acf47cdcc2a3"

xhyve $MEM $SMP $PCI_DEV $LPC_DEV $NET $IMG_CD $IMG_HDD $UUID -f kexec,$KERNEL,$INITRD,"$CMDLINE"
```

BTW: I've also installed debian 7, and networking  works properly.

**Comment by jailbird777** [comment]
Strangely, it DOES work in Oracle Linux 6.6...

**Comment by timfallmk** [comment]
@Darren do you have the `virtio` drivers loaded? I've seen a few topics about how they need to be loaded in the initrd as a flag at boot time to work properly.

**Comment by Darren** [comment]
I reinstalled again, this time I have specified UUID and it works.

Maybe It did not work because I have messed up the udev rules last time

**Comment by tommythorn** [comment]
Darren, I have this issue too. Mind sharing what exactly you had to do?

**Comment by Darren** [comment]
@tommythorn  
Try specifying UUID on the command line before you start the installation process?

Last time I only specified it after the installation process is complete and mess around the udev
persistent rules and it did not work.
